{
  "$schema": "https://json-schema.org/draft/2020-12/schema",
  "$id": "urn:bkg:public-roster:v2",
  "title": "BKG public roster export v2",
  "description": "Reviewed active member data with administrator-resolved map locations and sanitized first-party photo descriptors. Raw QRZ observations, private fields, source URLs, and audit state are excluded.",
  "type": "object",
  "additionalProperties": false,
  "required": [
    "schema_version",
    "generated_at",
    "content_hash",
    "members",
    "og_assignments"
  ],
  "properties": {
    "schema_version": {
      "type": "string",
      "const": "2"
    },
    "generated_at": {
      "type": "string",
      "format": "date-time",
      "description": "UTC export generation time. Excluded from content_hash."
    },
    "content_hash": {
      "type": "string",
      "pattern": "^sha256:[0-9a-f]{64}$",
      "description": "SHA-256 of UTF-8 compact recursively key-sorted JSON containing only schema_version, members, and og_assignments. Unicode remains unescaped and array order is preserved."
    },
    "members": {
      "type": "array",
      "description": "Active members, ordered by ascending numeric BKG number. All strings come from the stored reviewed member record.",
      "items": {
        "$ref": "#/$defs/member"
      }
    },
    "og_assignments": {
      "type": "array",
      "description": "Stored OG assignments with active holders, ordered by region_key using SQLite BINARY collation. Inactive holders are suppressed; OGs are never recomputed or reassigned by the export.",
      "items": {
        "$ref": "#/$defs/og_assignment"
      }
    }
  },
  "$defs": {
    "bkg_number": {
      "type": "integer",
      "minimum": 1,
      "maximum": 9007199254740991,
      "description": "Stable numeric member number. Render BKG plus this number for display."
    },
    "member": {
      "type": "object",
      "additionalProperties": false,
      "required": [
        "bkg_number",
        "callsign",
        "name",
        "qth",
        "qso_date",
        "sponsor_bkg_number",
        "map_location",
        "photo"
      ],
      "properties": {
        "bkg_number": {
          "$ref": "#/$defs/bkg_number"
        },
        "callsign": {
          "type": "string"
        },
        "name": {
          "type": "string"
        },
        "qth": {
          "type": "string",
          "description": "Reviewed location label. Empty means unknown; this is not raw QRZ data."
        },
        "qso_date": {
          "type": "string",
          "description": "Stored QSO date, which the website displays as Join Date. Preserved verbatim, including historical date formats or an empty value; never replaced by issuance/creation time."
        },
        "sponsor_bkg_number": {
          "anyOf": [
            {
              "$ref": "#/$defs/bkg_number"
            },
            {
              "type": "null"
            }
          ],
          "description": "BKG number reached through the stored sponsor member ID, only when that sponsor is active. Null for inactive or unresolved sponsors. Historical names, callsigns, and number text are never exposed or rebound."
        },
        "map_location": {
          "anyOf": [
            {
              "type": "null"
            },
            {
              "$ref": "#/$defs/map_location"
            }
          ],
          "description": "Administrator-resolved grid center. Null means unpublished; consumers must not add location enrichment."
        },
        "photo": {
          "anyOf": [
            {
              "type": "null"
            },
            {
              "$ref": "#/$defs/photo"
            }
          ],
          "description": "Sanitized first-party cached photo. Null means unpublished; consumers must not add a QRZ or local override."
        }
      }
    },
    "og_assignment": {
      "type": "object",
      "additionalProperties": false,
      "required": [
        "region_key",
        "region_label",
        "bkg_number"
      ],
      "properties": {
        "region_key": {
          "type": "string",
          "minLength": 1,
          "description": "Stored unique region key, such as US:IL or QTH:CANADA."
        },
        "region_label": {
          "type": "string",
          "minLength": 1,
          "description": "Stored display label, independent of the holder's current QTH."
        },
        "bkg_number": {
          "$ref": "#/$defs/bkg_number"
        }
      }
    },
    "map_location": {
      "type": "object",
      "additionalProperties": false,
      "required": [
        "grid",
        "lat",
        "lon"
      ],
      "properties": {
        "grid": {
          "type": "string",
          "pattern": "^[A-R]{2}[0-9]{2}([A-X]{2})?$",
          "description": "Four characters only when finer information is unavailable; six characters preserve the subsquare."
        },
        "lat": {
          "type": "number",
          "minimum": -90,
          "maximum": 90
        },
        "lon": {
          "type": "number",
          "minimum": -180,
          "maximum": 180
        }
      }
    },
    "photo": {
      "type": "object",
      "additionalProperties": false,
      "required": [
        "url",
        "sha256",
        "content_type",
        "byte_length"
      ],
      "properties": {
        "url": {
          "type": "string",
          "format": "uri",
          "pattern": "^https://[^/?#]+/api/roster/photos/[a-f0-9]{64}\\.webp$",
          "description": "Same origin as the roster endpoint, with filename matching sha256."
        },
        "sha256": {
          "type": "string",
          "pattern": "^[a-f0-9]{64}$"
        },
        "content_type": {
          "const": "image/webp"
        },
        "byte_length": {
          "type": "integer",
          "minimum": 1,
          "maximum": 1048576
        }
      }
    }
  }
}
