{
  "schema_version": "2",
  "members": [
    {
      "bkg_number": 1,
      "callsign": "N0SYN1",
      "name": "Synthetic First",
      "qth": "Illinois",
      "qso_date": "2026-08-21",
      "sponsor_bkg_number": null,
      "map_location": {
        "grid": "EN61AB",
        "lat": 41.0625,
        "lon": -87.95833333333333
      },
      "photo": null
    },
    {
      "bkg_number": 7,
      "callsign": "N0SYN7",
      "name": "Synthetic Reviewed",
      "qth": "Illinois",
      "qso_date": "8/31/2026",
      "sponsor_bkg_number": 1,
      "map_location": null,
      "photo": null
    },
    {
      "bkg_number": 12,
      "callsign": "N0SYN12",
      "name": "Zoë Example",
      "qth": "",
      "qso_date": "",
      "sponsor_bkg_number": null,
      "map_location": null,
      "photo": null
    },
    {
      "bkg_number": 21,
      "callsign": "VE3SYN",
      "name": "Synthetic Canada",
      "qth": "Canada",
      "qso_date": "Aug 21, 2026",
      "sponsor_bkg_number": 7,
      "map_location": {
        "grid": "FN03",
        "lat": 43.5,
        "lon": -79
      },
      "photo": null
    },
    {
      "bkg_number": 40,
      "callsign": "N0SYN40",
      "name": "Synthetic Orphan",
      "qth": "",
      "qso_date": "2026-08-25",
      "sponsor_bkg_number": null,
      "map_location": null,
      "photo": null
    },
    {
      "bkg_number": 88,
      "callsign": "K2SYN88",
      "name": "Synthetic Moved",
      "qth": "New York",
      "qso_date": "2026-07-02",
      "sponsor_bkg_number": 21,
      "map_location": {
        "grid": "FN33AA",
        "lat": 43.020833333333336,
        "lon": -73.95833333333333
      },
      "photo": null
    }
  ],
  "og_assignments": [
    {
      "region_key": "QTH:CANADA",
      "region_label": "Canada",
      "bkg_number": 21
    },
    {
      "region_key": "US:IL",
      "region_label": "IL",
      "bkg_number": 7
    },
    {
      "region_key": "US:VT",
      "region_label": "VT",
      "bkg_number": 88
    }
  ],
  "generated_at": "2026-09-29T12:00:00.000Z",
  "content_hash": "sha256:8857d8d9cfd7b57c22918780e189fea1139257817456607fbff6de089490e6a7"
}
